{
  "$comment": "Please do not edit this schema by hand. Generate it instead by running npm run build:schema.",
  "$schema": "http://json-schema.org/draft-04/schema#",
  "mozPipelineMetadata": {
    "bq_dataset_family": "pioneer_sgsb_beyond_the_paywall",
    "bq_metadata_format": "pioneer",
    "bq_table": "advertisement_v1",
    "expiration_policy": {
      "collect_through_date": "2022-12-31"
    }
  },
  "properties": {
    "ads": {
      "description": "This array contains an object per advertisement found",
      "items": {
        "properties": {
          "clientHeight": {
            "description": "The calculated height of the ad HTML element in pixels",
            "type": [
              "integer",
              "null"
            ]
          },
          "clientWidth": {
            "description": "The calculated width of the ad HTML element in pixels",
            "type": [
              "integer",
              "null"
            ]
          },
          "height": {
            "description": "The height of the HTML element, as listed in it's style attributes",
            "type": [
              "string",
              "null"
            ]
          },
          "id": {
            "description": "The ID of the ad, if listed in the HTML element",
            "type": [
              "string",
              "null"
            ]
          },
          "tag": {
            "description": "The HTML tag type that the ad was in",
            "type": [
              "string",
              "null"
            ]
          },
          "width": {
            "description": "The width of the HTML element, as listed in it's style attributes",
            "type": [
              "string",
              "null"
            ]
          }
        },
        "type": "object"
      },
      "type": [
        "array",
        "null"
      ]
    },
    "body": {
      "description": "This object contains two properties listed below about the <body> tag of the page.  This is needed to normalize the size of advertisments against full page size.",
      "properties": {
        "clientHeight": {
          "description": "The calculated height in pixels of the <body> tag",
          "type": [
            "integer",
            "null"
          ]
        },
        "clientWidth": {
          "description": "The calculated width in pixels of the <body> tag",
          "type": [
            "integer",
            "null"
          ]
        }
      },
      "type": "object"
    },
    "tabId": {
      "description": "The ID of the tab this data was collected from",
      "type": [
        "integer",
        "null"
      ]
    },
    "type": {
      "description": "the type of event recorded. Either WebScience.advertisements, WebScience.articleContents, WebScience.pageNav, or WebScience.pageNavSensitive",
      "enum": [
        "WebScience.advertisements",
        "WebScience.articleContents",
        "WebScience.pageNav",
        "WebScience.pageNavSensitive",
        "WebScience.totalTiming"
      ],
      "type": "string"
    },
    "url": {
      "description": "The URL of the page visited",
      "type": [
        "string",
        "null"
      ]
    },
    "userId": {
      "description": "a unique ID associated with a participant.",
      "type": "string"
    },
    "visitId": {
      "description": "a unique ID associated with a page visit.",
      "type": "string"
    }
  },
  "required": [
    "type",
    "visitId",
    "userId",
    "body"
  ],
  "type": "object"
}
