{
      "type": "WebScience.advertisements",
      "userId": "b4aeab86-1535-4701-8a20-a9aab64e0866",
      "visitId": "6743f613-4c9d-4c22-af21-28db956faac2",
      "url": "https://www.latimes.com/entertainment-arts/tv/story/2021-06-08/chris-harrison-the-bachelor-exit-matt-james-rachael-kirkconnell",
      "body": {
        "clientHeight": 7293,
        "clientWidth": 1316
      },
      "ads": [
        {
          "id": "google_ads_iframe_/21787098806/web.latimes/entertainment-arts/television_0",
          "tag": "IFRAME",
          "clientHeight": 90,
          "clientWidth": 728,
          "height": "90",
          "width": "728"
        }
      ]
  }