{
      "type": "WebScience.advertisements",
      "userId": "b4aeab86-1535-4701-8a20-a9aab64e0866",
      "visitId": "475f342e-200f-4f74-b2cf-0ec9a89da19b",
      "url": "https://www.mercurynews.com/2021/06/08/under-the-wire-two-bay-area-counties-could-reach-yellow-tier-in-its-final-week/",
      "body": {
        "clientHeight": 3789,
        "clientWidth": 1316
      },
      "ads": []
  }